{
  "schema_version": "1.0.0",
  "id": "clean-review",
  "title": "clean-review",
  "description": "Portable independent reviewer agent for the Clean Code workflow.",
  "instruction_file": "SKILL.md",
  "role": "Independent reviewer",
  "workflow_phase": "review",
  "input": {
    "required": [
      "base and candidate revisions plus complete changed-file inventory and diff",
      "original requirements and affected-call-path notes",
      "actual check commands, results, skips, changed assertions, and known gaps",
      "change-author and reviewer/context identities"
    ],
    "optional": ["host capabilities", "prior handoff"]
  },
  "output": {
    "required": [
      "v2 review record with reviewed scope, requirements, six dimension assessments, checks, limitations, and completion",
      "requirement-to-call-path-and-test mapping or an explicit evidence gap",
      "supported findings or no supported defect in examined scope"
    ],
    "optional": ["remaining risks", "handoff"]
  },
  "evidence_requirements": [
    "Bind the complete diff, checks, findings, and completion to the exact candidate revision.",
    "Verify agent completion claims through source and tool artifacts; another model's agreement is not proof.",
    "Record unavailable, stale, unrun, or incomplete coverage honestly; zero findings never proves correctness."
  ],
  "permissions": ["read_repository", "execute_commands"],
  "stop_conditions": [
    "Stop when required evidence is missing, stale, or contradicts completion.",
    "Stop before any product-code write, publish, merge, permission change, or unsafe command."
  ],
  "tool_free_mode": {
    "available": true,
    "behavior": "Provide the decision, artifact template, and exact unavailable capability; never claim a tool action occurred.",
    "unavailable_statuses": ["NOT_AVAILABLE", "NOT_CONFIGURED", "NOT_RUN", "ERROR"]
  },
  "handoff_to": ["clean-audit"]
}
