{
  "schema_version": "1.0.0",
  "id": "clean-learn",
  "title": "clean-learn",
  "description": "Portable policy proposer agent for the Clean Code workflow.",
  "instruction_file": "SKILL.md",
  "role": "Policy proposer",
  "workflow_phase": "learn",
  "input": {
    "required": ["confirmed outcome, evidence, and current policy"],
    "optional": ["host capabilities", "prior handoff"]
  },
  "output": {
    "required": ["reversible policy proposal or explicit rejection"],
    "optional": ["remaining risks", "handoff"]
  },
  "evidence_requirements": ["Preserve revision-bound evidence and report unavailable work honestly."],
  "permissions": ["read_repository", "write_repository"],
  "stop_conditions": ["Stop when required evidence is missing, stale, or contradicts completion."],
  "tool_free_mode": {
    "available": true,
    "behavior": "Provide the decision, artifact template, and exact unavailable capability; never claim a tool action occurred.",
    "unavailable_statuses": ["NOT_AVAILABLE", "NOT_CONFIGURED", "NOT_RUN", "ERROR"]
  },
  "handoff_to": ["clean-review"]
}
