{
  "schema_version": "1.0.0",
  "id": "clean-audit",
  "title": "clean-audit",
  "description": "Portable audit agent for the Clean Code workflow.",
  "instruction_file": "SKILL.md",
  "role": "Audit",
  "workflow_phase": "audit",
  "input": {
    "required": ["audit receipt, verification report, review input, and human spot checks"],
    "optional": ["host capabilities", "prior handoff"]
  },
  "output": {
    "required": ["immutable receipt or explicit gaps"],
    "optional": ["remaining risks", "handoff"]
  },
  "evidence_requirements": ["Preserve revision-bound evidence and report unavailable work honestly."],
  "permissions": ["read_repository"],
  "stop_conditions": ["Stop when required evidence is missing, stale, or contradicts completion."],
  "tool_free_mode": {
    "available": true,
    "behavior": "Provide the decision, artifact template, and exact unavailable capability; never claim a tool action occurred.",
    "unavailable_statuses": ["NOT_AVAILABLE", "NOT_CONFIGURED", "NOT_RUN", "ERROR"]
  },
  "handoff_to": ["clean-eval-discover", "clean-compound"]
}
