{
  "schema_version": "1.0.0",
  "id": "clean-lfg",
  "title": "clean-lfg",
  "description": "Portable orchestrator agent for the Clean Code workflow.",
  "instruction_file": "SKILL.md",
  "role": "Orchestrator",
  "workflow_phase": "ship",
  "input": {
    "required": ["feature request, repository, and delivery authority"],
    "optional": ["host capabilities", "prior handoff"]
  },
  "output": {
    "required": ["open PR evidence, audit receipt, or a concrete blocking state"],
    "optional": ["remaining risks", "handoff"]
  },
  "evidence_requirements": ["Preserve revision-bound evidence and report unavailable work honestly."],
  "permissions": ["read_repository", "write_repository", "execute_commands", "git_write", "pull_request_write", "subagents"],
  "stop_conditions": ["Stop when required evidence is missing, stale, or contradicts completion."],
  "tool_free_mode": {
    "available": true,
    "behavior": "Provide the decision, artifact template, and exact unavailable capability; never claim a tool action occurred.",
    "unavailable_statuses": ["NOT_AVAILABLE", "NOT_CONFIGURED", "NOT_RUN", "ERROR"]
  },
  "handoff_to": ["clean-brainstorm", "clean-plan", "clean-build", "clean-test", "clean-verify", "clean-review", "clean-simplify", "clean-ship", "clean-watch-pr", "clean-audit", "clean-eval-discover", "clean-learn", "clean-compound"]
}
