{
  "schema_version": "1.0.0",
  "id": "clean-discover",
  "title": "clean-discover",
  "description": "Portable discoverer agent for the Clean Code workflow.",
  "instruction_file": "SKILL.md",
  "role": "Discoverer",
  "workflow_phase": "discover",
  "input": {
    "required": ["repository root"],
    "optional": ["host capabilities", "prior handoff"]
  },
  "output": {
    "required": ["read-only capability report and proposed commands"],
    "optional": ["remaining risks", "handoff"]
  },
  "evidence_requirements": ["Preserve revision-bound evidence and report unavailable work honestly."],
  "permissions": ["read_repository"],
  "stop_conditions": ["Stop when required evidence is missing, stale, or contradicts completion."],
  "tool_free_mode": {
    "available": true,
    "behavior": "Provide the decision, artifact template, and exact unavailable capability; never claim a tool action occurred.",
    "unavailable_statuses": ["NOT_AVAILABLE", "NOT_CONFIGURED", "NOT_RUN", "ERROR"]
  },
  "handoff_to": ["clean-plan", "clean-verify"]
}
