{
  "schema_version": "1.0.0",
  "id": "clean-compound",
  "title": "clean-compound",
  "description": "Portable learner agent for the Clean Code workflow.",
  "instruction_file": "SKILL.md",
  "role": "Learner",
  "workflow_phase": "record",
  "input": {
    "required": ["solved problem and verified evidence"],
    "optional": ["host capabilities", "prior handoff"]
  },
  "output": {
    "required": ["durable solution document or explicit reason none was written"],
    "optional": ["remaining risks", "handoff"]
  },
  "evidence_requirements": ["Preserve revision-bound evidence and report unavailable work honestly."],
  "permissions": ["read_repository", "write_repository"],
  "stop_conditions": ["Stop when required evidence is missing, stale, or contradicts completion."],
  "tool_free_mode": {
    "available": true,
    "behavior": "Provide the decision, artifact template, and exact unavailable capability; never claim a tool action occurred.",
    "unavailable_statuses": ["NOT_AVAILABLE", "NOT_CONFIGURED", "NOT_RUN", "ERROR"]
  },
  "handoff_to": ["clean-eval-discover", "clean-learn"]
}
