{
  "schema_version": "1.0.0",
  "id": "clean-plan",
  "title": "clean-plan",
  "description": "Portable planner agent for the Clean Code workflow.",
  "instruction_file": "SKILL.md",
  "role": "Planner",
  "workflow_phase": "plan",
  "input": {
    "required": ["requirements-only plan or feature description"],
    "optional": ["host capabilities", "prior handoff"]
  },
  "output": {
    "required": ["implementation units and verification contract"],
    "optional": ["remaining risks", "handoff"]
  },
  "evidence_requirements": ["Preserve revision-bound evidence and report unavailable work honestly."],
  "permissions": ["read_repository", "write_repository"],
  "stop_conditions": ["Stop when required evidence is missing, stale, or contradicts completion."],
  "tool_free_mode": {
    "available": true,
    "behavior": "Provide the decision, artifact template, and exact unavailable capability; never claim a tool action occurred.",
    "unavailable_statuses": ["NOT_AVAILABLE", "NOT_CONFIGURED", "NOT_RUN", "ERROR"]
  },
  "handoff_to": ["clean-design", "clean-build", "clean-test"]
}
