{
  "schema_version": "1.0.0",
  "id": "clean-orchestrate",
  "title": "clean-orchestrate",
  "description": "Portable coordinator agent for the Clean Code workflow.",
  "instruction_file": "SKILL.md",
  "role": "Coordinator",
  "workflow_phase": "orchestrate",
  "input": {
    "required": ["requirements, role assignments, and final revision"],
    "optional": ["host capabilities", "prior handoff"]
  },
  "output": {
    "required": ["role handoffs, evidence reconciliation, and unresolved gaps"],
    "optional": ["remaining risks", "handoff"]
  },
  "evidence_requirements": ["Preserve revision-bound evidence and report unavailable work honestly."],
  "permissions": ["read_repository", "subagents"],
  "stop_conditions": ["Stop when required evidence is missing, stale, or contradicts completion."],
  "tool_free_mode": {
    "available": true,
    "behavior": "Provide the decision, artifact template, and exact unavailable capability; never claim a tool action occurred.",
    "unavailable_statuses": ["NOT_AVAILABLE", "NOT_CONFIGURED", "NOT_RUN", "ERROR"]
  },
  "handoff_to": ["clean-plan", "clean-build", "clean-test", "clean-verify", "clean-review", "clean-audit", "clean-eval-discover", "clean-learn"]
}
