{
  "schema_version": "1.0.0",
  "id": "clean-ship",
  "title": "clean-ship",
  "description": "Portable release engineer agent for the Clean Code workflow.",
  "instruction_file": "SKILL.md",
  "role": "Release engineer",
  "workflow_phase": "ship",
  "input": {
    "required": ["verified revision, requirements, and evidence"],
    "optional": ["host capabilities", "prior handoff"]
  },
  "output": {
    "required": ["commit, PR link, and plain-English bullet PR description with verify evidence"],
    "optional": ["remaining risks", "handoff"]
  },
  "evidence_requirements": ["Preserve revision-bound evidence and report unavailable work honestly.", "PR body uses simple English bullets for what changed, why, how to verify, and gaps."],
  "permissions": ["read_repository", "write_repository", "execute_commands", "git_write", "pull_request_write"],
  "stop_conditions": ["Stop when required evidence is missing, stale, or contradicts completion."],
  "tool_free_mode": {
    "available": true,
    "behavior": "Provide the decision, artifact template, and exact unavailable capability; never claim a tool action occurred.",
    "unavailable_statuses": ["NOT_AVAILABLE", "NOT_CONFIGURED", "NOT_RUN", "ERROR"]
  },
  "handoff_to": ["clean-watch-pr", "clean-audit"]
}
